No.     Time           Source                Destination           Protocol Length Info
      1 0.000000       127.0.0.1             127.0.0.1             TCP      56     51304 → 5090 [SYN] Seq=0 Win=8192 Len=0 MSS=65495 WS=256 SACK_PERM=1

Frame 1: 56 bytes on wire (448 bits), 56 bytes captured (448 bits) on interface 0
Null/Loopback
Internet Protocol Version 4, Src: 127.0.0.1, Dst: 127.0.0.1
Transmission Control Protocol, Src Port: 51304, Dst Port: 5090, Seq: 0, Len: 0

No.     Time           Source                Destination           Protocol Length Info
      2 0.000083       127.0.0.1             127.0.0.1             TCP      56     5090 → 51304 [SYN, ACK] Seq=0 Ack=1 Win=8192 Len=0 MSS=65495 WS=256 SACK_PERM=1

Frame 2: 56 bytes on wire (448 bits), 56 bytes captured (448 bits) on interface 0
Null/Loopback
Internet Protocol Version 4, Src: 127.0.0.1, Dst: 127.0.0.1
Transmission Control Protocol, Src Port: 5090, Dst Port: 51304, Seq: 0, Ack: 1, Len: 0

No.     Time           Source                Destination           Protocol Length Info
      3 0.000167       127.0.0.1             127.0.0.1             TCP      44     51304 → 5090 [ACK] Seq=1 Ack=1 Win=8192 Len=0

Frame 3: 44 bytes on wire (352 bits), 44 bytes captured (352 bits) on interface 0
Null/Loopback
Internet Protocol Version 4, Src: 127.0.0.1, Dst: 127.0.0.1
Transmission Control Protocol, Src Port: 51304, Dst Port: 5090, Seq: 1, Ack: 1, Len: 0

No.     Time           Source                Destination           Protocol Length Info
      4 0.000506       127.0.0.1             127.0.0.1             TCP      54     51304 → 5090 [PSH, ACK] Seq=1 Ack=1 Win=8192 Len=10

Frame 4: 54 bytes on wire (432 bits), 54 bytes captured (432 bits) on interface 0
Null/Loopback
Internet Protocol Version 4, Src: 127.0.0.1, Dst: 127.0.0.1
Transmission Control Protocol, Src Port: 51304, Dst Port: 5090, Seq: 1, Ack: 1, Len: 10
Data (10 bytes)

0000  49 27 6d 20 63 6c 69 65 6e 74                     I'm client

No.     Time           Source                Destination           Protocol Length Info
      5 0.000543       127.0.0.1             127.0.0.1             TCP      44     5090 → 51304 [ACK] Seq=1 Ack=11 Win=7936 Len=0

Frame 5: 44 bytes on wire (352 bits), 44 bytes captured (352 bits) on interface 0
Null/Loopback
Internet Protocol Version 4, Src: 127.0.0.1, Dst: 127.0.0.1
Transmission Control Protocol, Src Port: 5090, Dst Port: 51304, Seq: 1, Ack: 11, Len: 0

No.     Time           Source                Destination           Protocol Length Info
      6 0.004264       127.0.0.1             127.0.0.1             TCP      54     5090 → 51304 [PSH, ACK] Seq=1 Ack=11 Win=7936 Len=10

Frame 6: 54 bytes on wire (432 bits), 54 bytes captured (432 bits) on interface 0
Null/Loopback
Internet Protocol Version 4, Src: 127.0.0.1, Dst: 127.0.0.1
Transmission Control Protocol, Src Port: 5090, Dst Port: 51304, Seq: 1, Ack: 11, Len: 10
Data (10 bytes)

0000  49 27 6d 20 73 65 72 76 65 72                     I'm server

No.     Time           Source                Destination           Protocol Length Info
      7 0.004297       127.0.0.1             127.0.0.1             TCP      44     51304 → 5090 [ACK] Seq=11 Ack=11 Win=7936 Len=0

Frame 7: 44 bytes on wire (352 bits), 44 bytes captured (352 bits) on interface 0
Null/Loopback
Internet Protocol Version 4, Src: 127.0.0.1, Dst: 127.0.0.1
Transmission Control Protocol, Src Port: 51304, Dst Port: 5090, Seq: 11, Ack: 11, Len: 0

No.     Time           Source                Destination           Protocol Length Info
      8 3.008039       127.0.0.1             127.0.0.1             TCP      54     51304 → 5090 [PSH, ACK] Seq=11 Ack=11 Win=7936 Len=10

Frame 8: 54 bytes on wire (432 bits), 54 bytes captured (432 bits) on interface 0
Null/Loopback
Internet Protocol Version 4, Src: 127.0.0.1, Dst: 127.0.0.1
Transmission Control Protocol, Src Port: 51304, Dst Port: 5090, Seq: 11, Ack: 11, Len: 10
Data (10 bytes)

0000  49 27 6d 20 63 6c 69 65 6e 74                     I'm client

No.     Time           Source                Destination           Protocol Length Info
      9 3.008074       127.0.0.1             127.0.0.1             TCP      44     5090 → 51304 [ACK] Seq=11 Ack=21 Win=7936 Len=0

Frame 9: 44 bytes on wire (352 bits), 44 bytes captured (352 bits) on interface 0
Null/Loopback
Internet Protocol Version 4, Src: 127.0.0.1, Dst: 127.0.0.1
Transmission Control Protocol, Src Port: 5090, Dst Port: 51304, Seq: 11, Ack: 21, Len: 0

No.     Time           Source                Destination           Protocol Length Info
     10 3.008368       127.0.0.1             127.0.0.1             TCP      54     5090 → 51304 [PSH, ACK] Seq=11 Ack=21 Win=7936 Len=10

Frame 10: 54 bytes on wire (432 bits), 54 bytes captured (432 bits) on interface 0
Null/Loopback
Internet Protocol Version 4, Src: 127.0.0.1, Dst: 127.0.0.1
Transmission Control Protocol, Src Port: 5090, Dst Port: 51304, Seq: 11, Ack: 21, Len: 10
Data (10 bytes)

0000  49 27 6d 20 73 65 72 76 65 72                     I'm server

No.     Time           Source                Destination           Protocol Length Info
     11 3.008400       127.0.0.1             127.0.0.1             TCP      44     51304 → 5090 [ACK] Seq=21 Ack=21 Win=7936 Len=0

Frame 11: 44 bytes on wire (352 bits), 44 bytes captured (352 bits) on interface 0
Null/Loopback
Internet Protocol Version 4, Src: 127.0.0.1, Dst: 127.0.0.1
Transmission Control Protocol, Src Port: 51304, Dst Port: 5090, Seq: 21, Ack: 21, Len: 0

No.     Time           Source                Destination           Protocol Length Info
     12 6.010896       127.0.0.1             127.0.0.1             TCP      54     51304 → 5090 [PSH, ACK] Seq=21 Ack=21 Win=7936 Len=10

Frame 12: 54 bytes on wire (432 bits), 54 bytes captured (432 bits) on interface 0
Null/Loopback
Internet Protocol Version 4, Src: 127.0.0.1, Dst: 127.0.0.1
Transmission Control Protocol, Src Port: 51304, Dst Port: 5090, Seq: 21, Ack: 21, Len: 10
Data (10 bytes)

0000  49 27 6d 20 63 6c 69 65 6e 74                     I'm client

No.     Time           Source                Destination           Protocol Length Info
     13 6.010958       127.0.0.1             127.0.0.1             TCP      44     5090 → 51304 [ACK] Seq=21 Ack=31 Win=7936 Len=0

Frame 13: 44 bytes on wire (352 bits), 44 bytes captured (352 bits) on interface 0
Null/Loopback
Internet Protocol Version 4, Src: 127.0.0.1, Dst: 127.0.0.1
Transmission Control Protocol, Src Port: 5090, Dst Port: 51304, Seq: 21, Ack: 31, Len: 0

No.     Time           Source                Destination           Protocol Length Info
     14 6.012082       127.0.0.1             127.0.0.1             TCP      54     5090 → 51304 [PSH, ACK] Seq=21 Ack=31 Win=7936 Len=10

Frame 14: 54 bytes on wire (432 bits), 54 bytes captured (432 bits) on interface 0
Null/Loopback
Internet Protocol Version 4, Src: 127.0.0.1, Dst: 127.0.0.1
Transmission Control Protocol, Src Port: 5090, Dst Port: 51304, Seq: 21, Ack: 31, Len: 10
Data (10 bytes)

0000  49 27 6d 20 73 65 72 76 65 72                     I'm server

No.     Time           Source                Destination           Protocol Length Info
     15 6.012122       127.0.0.1             127.0.0.1             TCP      44     51304 → 5090 [ACK] Seq=31 Ack=31 Win=7936 Len=0

Frame 15: 44 bytes on wire (352 bits), 44 bytes captured (352 bits) on interface 0
Null/Loopback
Internet Protocol Version 4, Src: 127.0.0.1, Dst: 127.0.0.1
Transmission Control Protocol, Src Port: 51304, Dst Port: 5090, Seq: 31, Ack: 31, Len: 0

No.     Time           Source                Destination           Protocol Length Info
     16 9.025976       127.0.0.1             127.0.0.1             TCP      54     51304 → 5090 [PSH, ACK] Seq=31 Ack=31 Win=7936 Len=10

Frame 16: 54 bytes on wire (432 bits), 54 bytes captured (432 bits) on interface 0
Null/Loopback
Internet Protocol Version 4, Src: 127.0.0.1, Dst: 127.0.0.1
Transmission Control Protocol, Src Port: 51304, Dst Port: 5090, Seq: 31, Ack: 31, Len: 10
Data (10 bytes)

0000  49 27 6d 20 63 6c 69 65 6e 74                     I'm client

No.     Time           Source                Destination           Protocol Length Info
     17 9.026013       127.0.0.1             127.0.0.1             TCP      44     5090 → 51304 [ACK] Seq=31 Ack=41 Win=7936 Len=0

Frame 17: 44 bytes on wire (352 bits), 44 bytes captured (352 bits) on interface 0
Null/Loopback
Internet Protocol Version 4, Src: 127.0.0.1, Dst: 127.0.0.1
Transmission Control Protocol, Src Port: 5090, Dst Port: 51304, Seq: 31, Ack: 41, Len: 0

No.     Time           Source                Destination           Protocol Length Info
     18 9.027026       127.0.0.1             127.0.0.1             TCP      54     5090 → 51304 [PSH, ACK] Seq=31 Ack=41 Win=7936 Len=10

Frame 18: 54 bytes on wire (432 bits), 54 bytes captured (432 bits) on interface 0
Null/Loopback
Internet Protocol Version 4, Src: 127.0.0.1, Dst: 127.0.0.1
Transmission Control Protocol, Src Port: 5090, Dst Port: 51304, Seq: 31, Ack: 41, Len: 10
Data (10 bytes)

0000  49 27 6d 20 73 65 72 76 65 72                     I'm server

No.     Time           Source                Destination           Protocol Length Info
     19 9.027046       127.0.0.1             127.0.0.1             TCP      44     51304 → 5090 [ACK] Seq=41 Ack=41 Win=7936 Len=0

Frame 19: 44 bytes on wire (352 bits), 44 bytes captured (352 bits) on interface 0
Null/Loopback
Internet Protocol Version 4, Src: 127.0.0.1, Dst: 127.0.0.1
Transmission Control Protocol, Src Port: 51304, Dst Port: 5090, Seq: 41, Ack: 41, Len: 0

No.     Time           Source                Destination           Protocol Length Info
     20 12.026214      127.0.0.1             127.0.0.1             TCP      54     51304 → 5090 [PSH, ACK] Seq=41 Ack=41 Win=7936 Len=10

Frame 20: 54 bytes on wire (432 bits), 54 bytes captured (432 bits) on interface 0
Null/Loopback
Internet Protocol Version 4, Src: 127.0.0.1, Dst: 127.0.0.1
Transmission Control Protocol, Src Port: 51304, Dst Port: 5090, Seq: 41, Ack: 41, Len: 10
Data (10 bytes)

0000  49 27 6d 20 63 6c 69 65 6e 74                     I'm client

No.     Time           Source                Destination           Protocol Length Info
     21 12.026239      127.0.0.1             127.0.0.1             TCP      44     5090 → 51304 [ACK] Seq=41 Ack=51 Win=7936 Len=0

Frame 21: 44 bytes on wire (352 bits), 44 bytes captured (352 bits) on interface 0
Null/Loopback
Internet Protocol Version 4, Src: 127.0.0.1, Dst: 127.0.0.1
Transmission Control Protocol, Src Port: 5090, Dst Port: 51304, Seq: 41, Ack: 51, Len: 0

No.     Time           Source                Destination           Protocol Length Info
     22 12.026465      127.0.0.1             127.0.0.1             TCP      54     5090 → 51304 [PSH, ACK] Seq=41 Ack=51 Win=7936 Len=10

Frame 22: 54 bytes on wire (432 bits), 54 bytes captured (432 bits) on interface 0
Null/Loopback
Internet Protocol Version 4, Src: 127.0.0.1, Dst: 127.0.0.1
Transmission Control Protocol, Src Port: 5090, Dst Port: 51304, Seq: 41, Ack: 51, Len: 10
Data (10 bytes)

0000  49 27 6d 20 73 65 72 76 65 72                     I'm server

No.     Time           Source                Destination           Protocol Length Info
     23 12.026483      127.0.0.1             127.0.0.1             TCP      44     51304 → 5090 [ACK] Seq=51 Ack=51 Win=7936 Len=0

Frame 23: 44 bytes on wire (352 bits), 44 bytes captured (352 bits) on interface 0
Null/Loopback
Internet Protocol Version 4, Src: 127.0.0.1, Dst: 127.0.0.1
Transmission Control Protocol, Src Port: 51304, Dst Port: 5090, Seq: 51, Ack: 51, Len: 0

No.     Time           Source                Destination           Protocol Length Info
     24 15.027210      127.0.0.1             127.0.0.1             TCP      54     51304 → 5090 [PSH, ACK] Seq=51 Ack=51 Win=7936 Len=10

Frame 24: 54 bytes on wire (432 bits), 54 bytes captured (432 bits) on interface 0
Null/Loopback
Internet Protocol Version 4, Src: 127.0.0.1, Dst: 127.0.0.1
Transmission Control Protocol, Src Port: 51304, Dst Port: 5090, Seq: 51, Ack: 51, Len: 10
Data (10 bytes)

0000  49 27 6d 20 63 6c 69 65 6e 74                     I'm client

No.     Time           Source                Destination           Protocol Length Info
     25 15.027240      127.0.0.1             127.0.0.1             TCP      44     5090 → 51304 [ACK] Seq=51 Ack=61 Win=7936 Len=0

Frame 25: 44 bytes on wire (352 bits), 44 bytes captured (352 bits) on interface 0
Null/Loopback
Internet Protocol Version 4, Src: 127.0.0.1, Dst: 127.0.0.1
Transmission Control Protocol, Src Port: 5090, Dst Port: 51304, Seq: 51, Ack: 61, Len: 0

No.     Time           Source                Destination           Protocol Length Info
     26 15.028249      127.0.0.1             127.0.0.1             TCP      54     5090 → 51304 [PSH, ACK] Seq=51 Ack=61 Win=7936 Len=10

Frame 26: 54 bytes on wire (432 bits), 54 bytes captured (432 bits) on interface 0
Null/Loopback
Internet Protocol Version 4, Src: 127.0.0.1, Dst: 127.0.0.1
Transmission Control Protocol, Src Port: 5090, Dst Port: 51304, Seq: 51, Ack: 61, Len: 10
Data (10 bytes)

0000  49 27 6d 20 73 65 72 76 65 72                     I'm server

No.     Time           Source                Destination           Protocol Length Info
     27 15.028270      127.0.0.1             127.0.0.1             TCP      44     51304 → 5090 [ACK] Seq=61 Ack=61 Win=7936 Len=0

Frame 27: 44 bytes on wire (352 bits), 44 bytes captured (352 bits) on interface 0
Null/Loopback
Internet Protocol Version 4, Src: 127.0.0.1, Dst: 127.0.0.1
Transmission Control Protocol, Src Port: 51304, Dst Port: 5090, Seq: 61, Ack: 61, Len: 0

No.     Time           Source                Destination           Protocol Length Info
     28 18.031201      127.0.0.1             127.0.0.1             TCP      54     51304 → 5090 [PSH, ACK] Seq=61 Ack=61 Win=7936 Len=10

Frame 28: 54 bytes on wire (432 bits), 54 bytes captured (432 bits) on interface 0
Null/Loopback
Internet Protocol Version 4, Src: 127.0.0.1, Dst: 127.0.0.1
Transmission Control Protocol, Src Port: 51304, Dst Port: 5090, Seq: 61, Ack: 61, Len: 10
Data (10 bytes)

0000  49 27 6d 20 63 6c 69 65 6e 74                     I'm client

No.     Time           Source                Destination           Protocol Length Info
     29 18.031241      127.0.0.1             127.0.0.1             TCP      44     5090 → 51304 [ACK] Seq=61 Ack=71 Win=7936 Len=0

Frame 29: 44 bytes on wire (352 bits), 44 bytes captured (352 bits) on interface 0
Null/Loopback
Internet Protocol Version 4, Src: 127.0.0.1, Dst: 127.0.0.1
Transmission Control Protocol, Src Port: 5090, Dst Port: 51304, Seq: 61, Ack: 71, Len: 0

No.     Time           Source                Destination           Protocol Length Info
     30 18.032337      127.0.0.1             127.0.0.1             TCP      54     5090 → 51304 [PSH, ACK] Seq=61 Ack=71 Win=7936 Len=10

Frame 30: 54 bytes on wire (432 bits), 54 bytes captured (432 bits) on interface 0
Null/Loopback
Internet Protocol Version 4, Src: 127.0.0.1, Dst: 127.0.0.1
Transmission Control Protocol, Src Port: 5090, Dst Port: 51304, Seq: 61, Ack: 71, Len: 10
Data (10 bytes)

0000  49 27 6d 20 73 65 72 76 65 72                     I'm server

No.     Time           Source                Destination           Protocol Length Info
     31 18.032360      127.0.0.1             127.0.0.1             TCP      44     51304 → 5090 [ACK] Seq=71 Ack=71 Win=7936 Len=0

Frame 31: 44 bytes on wire (352 bits), 44 bytes captured (352 bits) on interface 0
Null/Loopback
Internet Protocol Version 4, Src: 127.0.0.1, Dst: 127.0.0.1
Transmission Control Protocol, Src Port: 51304, Dst Port: 5090, Seq: 71, Ack: 71, Len: 0

No.     Time           Source                Destination           Protocol Length Info
     32 21.035600      127.0.0.1             127.0.0.1             TCP      54     51304 → 5090 [PSH, ACK] Seq=71 Ack=71 Win=7936 Len=10

Frame 32: 54 bytes on wire (432 bits), 54 bytes captured (432 bits) on interface 0
Null/Loopback
Internet Protocol Version 4, Src: 127.0.0.1, Dst: 127.0.0.1
Transmission Control Protocol, Src Port: 51304, Dst Port: 5090, Seq: 71, Ack: 71, Len: 10
Data (10 bytes)

0000  49 27 6d 20 63 6c 69 65 6e 74                     I'm client

No.     Time           Source                Destination           Protocol Length Info
     33 21.035635      127.0.0.1             127.0.0.1             TCP      44     5090 → 51304 [ACK] Seq=71 Ack=81 Win=7936 Len=0

Frame 33: 44 bytes on wire (352 bits), 44 bytes captured (352 bits) on interface 0
Null/Loopback
Internet Protocol Version 4, Src: 127.0.0.1, Dst: 127.0.0.1
Transmission Control Protocol, Src Port: 5090, Dst Port: 51304, Seq: 71, Ack: 81, Len: 0

No.     Time           Source                Destination           Protocol Length Info
     34 21.036057      127.0.0.1             127.0.0.1             TCP      54     5090 → 51304 [PSH, ACK] Seq=71 Ack=81 Win=7936 Len=10

Frame 34: 54 bytes on wire (432 bits), 54 bytes captured (432 bits) on interface 0
Null/Loopback
Internet Protocol Version 4, Src: 127.0.0.1, Dst: 127.0.0.1
Transmission Control Protocol, Src Port: 5090, Dst Port: 51304, Seq: 71, Ack: 81, Len: 10
Data (10 bytes)

0000  49 27 6d 20 73 65 72 76 65 72                     I'm server

No.     Time           Source                Destination           Protocol Length Info
     35 21.036079      127.0.0.1             127.0.0.1             TCP      44     51304 → 5090 [ACK] Seq=81 Ack=81 Win=7936 Len=0

Frame 35: 44 bytes on wire (352 bits), 44 bytes captured (352 bits) on interface 0
Null/Loopback
Internet Protocol Version 4, Src: 127.0.0.1, Dst: 127.0.0.1
Transmission Control Protocol, Src Port: 51304, Dst Port: 5090, Seq: 81, Ack: 81, Len: 0
